<?xml version="1.0" encoding="UTF-8" ?>
<r xmlns="http://pear.php.net/dtd/rest.release"
    xmlns:xsi="http://www.w3.org/2001/XMLSchema-instance"
    xmlns:xlink="http://www.w3.org/1999/xlink"
    xsi:schemaLocation="http://pear.php.net/dtd/rest.release
    https://pear.php.net/dtd/rest.release.xsd">
 <p xlink:href="/rest/p/http">HTTP</p>
 <c>pear.php.net</c>
 <v>1.3.0RC2</v>
 <st>beta</st>
 <l>PHP License</l>
 <m>mike</m>
 <s>Miscellaneous HTTP utilities</s>
 <d>The HTTP class is a class with static methods for doing miscellaneous
HTTP-related stuff like date formatting or language negotiation.
</d>
 <da>2004-06-30 08:42:14</da>
 <n>* Fix Bug #1748 - inproper format of date according to RFC850</n>
 <f>4299</f>
 <g>https://pear.php.net/get/HTTP-1.3.0RC2.tgz</g>
 <x xlink:href="package.1.3.0RC2.xml"/>
</r>