<?xml version="1.0" encoding="UTF-8" ?>
<r xmlns="http://pear.php.net/dtd/rest.release"
    xmlns:xsi="http://www.w3.org/2001/XMLSchema-instance"
    xmlns:xlink="http://www.w3.org/1999/xlink"
    xsi:schemaLocation="http://pear.php.net/dtd/rest.release
    https://pear.php.net/dtd/rest.release.xsd">
 <p xlink:href="/rest/p/mdb2_driver_pgsql">MDB2_Driver_pgsql</p>
 <c>pear.php.net</c>
 <v>0.1.0</v>
 <st>beta</st>
 <l>BSD License</l>
 <m>lsmith</m>
 <s>pgsql MDB2 driver</s>
 <d>This is the PostGreSQL MDB2 driver.
 
</d>
 <da>2005-06-08 09:24:06</da>
 <n>first unbundled release from MDB2 core

- dont just check for isset() for boolean values in order to support
  setting them false as well (bug #4373)
- ensure SQL injection protection in all _quote() methods (was missing in
  some decimal, float, time, date and timestamp implementations)</n>
 <f>15498</f>
 <g>https://pear.php.net/get/MDB2_Driver_pgsql-0.1.0.tgz</g>
 <x xlink:href="package.0.1.0.xml"/>
</r>