<?xml version="1.0" encoding="UTF-8" ?>
<r xmlns="http://pear.php.net/dtd/rest.release"
    xmlns:xsi="http://www.w3.org/2001/XMLSchema-instance"
    xmlns:xlink="http://www.w3.org/1999/xlink"
    xsi:schemaLocation="http://pear.php.net/dtd/rest.release
    https://pear.php.net/dtd/rest.release.xsd">
 <p xlink:href="/rest/p/validate_fr">Validate_FR</p>
 <c>pear.php.net</c>
 <v>0.6.0</v>
 <st>beta</st>
 <l>New BSD</l>
 <m>doconnor</m>
 <s>Validation class for FR</s>
 <d>Package containes locale validation for FR such as:
 * SSN
 * Postal Code
 * RIB
 * SIREN
 * SIRET
 * Region (Departements)</d>
 <da>2009-09-21 01:06:57</da>
 <n>QA release
- release in beta
- Moosh take lead
- Updated to package 2.0 (doconnor)</n>
 <f>7714</f>
 <g>https://pear.php.net/get/Validate_FR-0.6.0.tgz</g>
 <x xlink:href="package.0.6.0.xml"/>
</r>