<?xml version="1.0" encoding="UTF-8" ?>
<r xmlns="http://pear.php.net/dtd/rest.release"
    xmlns:xsi="http://www.w3.org/2001/XMLSchema-instance"
    xmlns:xlink="http://www.w3.org/1999/xlink"
    xsi:schemaLocation="http://pear.php.net/dtd/rest.release
    https://pear.php.net/dtd/rest.release.xsd">
 <p xlink:href="/rest/p/html_template_it">HTML_Template_IT</p>
 <c>pear.php.net</c>
 <v>1.0.0</v>
 <st>stable</st>
 <l>PHP License</l>
 <m>pajoye</m>
 <s>Integrated Templates</s>
 <d>HTML_Template_IT:
Simple template API.
The Isotemplate API is somewhat tricky for a beginner although it is the best
one you can build. template::parse() [phplib template = Isotemplate] requests
you to name a source and a target where the current block gets parsed into.
Source and target can be block names or even handler names. This API gives you
a maximum of fexibility but you always have to know what you do which is
quite unusual for php skripter like me.

I noticed that I do not any control on which block gets parsed into which one.
If all blocks are within one file, the script knows how they are nested and in
which way you have to parse them. IT knows that inner1 is a child of block2, there's
no need to tell him about this.
Features :
  * Nested blocks
  * Include external file
  * Custom tags format (default {mytag})

HTML_Template_ITX :
With this class you get the full power of the phplib template class.
You may have one file with blocks in it but you have as well one main file
and multiple files one for each block. This is quite usefull when you have
user configurable websites. Using blocks not in the main template allows
you to modify some parts of your layout easily.
</d>
 <da>2002-09-13 01:26:00</da>
 <n>Stable release.</n>
 <f>12602</f>
 <g>https://pear.php.net/get/HTML_Template_IT-1.0.0.tgz</g>
 <x xlink:href="package.1.0.0.xml"/>
</r>