<?xml version="1.0" encoding="UTF-8" ?>
<r xmlns="http://pear.php.net/dtd/rest.release"
    xmlns:xsi="http://www.w3.org/2001/XMLSchema-instance"
    xmlns:xlink="http://www.w3.org/1999/xlink"
    xsi:schemaLocation="http://pear.php.net/dtd/rest.release
    https://pear.php.net/dtd/rest.release.xsd">
 <p xlink:href="/rest/p/xml_xpath">XML_XPath</p>
 <c>pear.php.net</c>
 <v>1.2.3</v>
 <st>stable</st>
 <l>PHP License</l>
 <m>arnaud</m>
 <s>The PEAR::XML_XPath class provided an XPath/DOM XML manipulation, maneuvering and query interface.</s>
 <d>The PEAR::XML_XPath class provided an XPath/DOM XML manipulation, maneuvering and 
query interface.
The class allows for easy manipulation, maneuvering and querying of a domxml tree using
both xpath queries and DOM walk functions.  It uses an internal pointer for all
methods on which the action is performed.  Results from an dom/xpath query are returned
as an XPath_Result object, which contains an internal array of DOM nodes and which extends 
the common DOM class and hence contains all the DOM functions from the main object to run
on each of the elements in the internal array.  This class tries to hold as close as possible       to the DOM Recommendation.  You MUST have the domxml extension to use this class.
The XML_XPath class was inspired by a class maintained by Nigel Swinson called phpxpath.
The phpxpath class does not rely on PHP xmldom functions and is therefore a sibling to
this class: http://sourceforge.net/projects/phpxpath
 
</d>
 <da>2005-10-18 01:25:39</da>
 <n>There is now a dependency on PHP4 since PHP5 has out-of-the-box for XPath in both DOM and SimpleXML.</n>
 <f>19179</f>
 <g>https://pear.php.net/get/XML_XPath-1.2.3.tgz</g>
 <x xlink:href="package.1.2.3.xml"/>
</r>