<?xml version="1.0" encoding="UTF-8" ?>
<r xmlns="http://pear.php.net/dtd/rest.release"
    xmlns:xsi="http://www.w3.org/2001/XMLSchema-instance"
    xmlns:xlink="http://www.w3.org/1999/xlink"
    xsi:schemaLocation="http://pear.php.net/dtd/rest.release
    https://pear.php.net/dtd/rest.release.xsd">
 <p xlink:href="/rest/p/html_progress2">HTML_Progress2</p>
 <c>pear.php.net</c>
 <v>2.1.1</v>
 <st>stable</st>
 <l>PHP License 3.01</l>
 <m>farell</m>
 <s>How to include a loading bar in your XHTML documents quickly and easily.</s>
 <d>This package provides a way to add a loading bar fully customizable in existing XHTML documents.
Your browser should accept DHTML feature.

Features:
- create horizontal, vertival bar and also circle, ellipse and polygons (square, rectangle).
- allows usage of existing external StyleSheet and/or JavaScript.
- all elements (progress, cells, labels) are customizable by their html properties.
- percent/labels are floating all around the progress meter.
- compliant with all CSS/XHMTL standards.
- integration with all template engines is very easy.
- implements Observer design pattern. It is possible to add Listeners.
- adds a customizable monitor pattern to display a progress bar.
  User-end can abort progress at any time.
- allows many progress meter on same page without uses of iframe solution.
- error handling system that support native PEAR_Error, but also PEAR_ErrorStack, and
  any other system you might want to plug-in.
- PHP 5 ready.</d>
 <da>2006-12-22 12:06:34</da>
 <n>* bugs
- fixed bug #8684 : Problem with generated JavaScript
- fixed &quot;examples/generatorcus.php&quot; to use new architecture with external stylesheet introduced on August 11, 2006.

* news (improved code)
- used now &quot;className&quot; property rather than &quot;visibility&quot;
and reduced div tags count used to build a progress bar (only 10 rather than 20 )
- apply more CS (space code indent, ...)
- add &quot;alt&quot; attribute to img html-tag to be more xhtml compliant
- JS function &quot;hideProgress&quot; lose its second parameter (no more needed)</n>
 <f>368598</f>
 <g>https://pear.php.net/get/HTML_Progress2-2.1.1.tgz</g>
 <x xlink:href="package.2.1.1.xml"/>
</r>