<?xml version="1.0" encoding="UTF-8" ?>
<r xmlns="http://pear.php.net/dtd/rest.release"
    xmlns:xsi="http://www.w3.org/2001/XMLSchema-instance"
    xmlns:xlink="http://www.w3.org/1999/xlink"
    xsi:schemaLocation="http://pear.php.net/dtd/rest.release
    https://pear.php.net/dtd/rest.release.xsd">
 <p xlink:href="/rest/p/log">Log</p>
 <c>pear.php.net</c>
 <v>1.8.4</v>
 <st>stable</st>
 <l>PHP License</l>
 <m>jon</m>
 <s>Logging utilities</s>
 <d>The Log framework provides an abstracted logging system.  It supports logging to console, file, syslog, SQL, Sqlite, mail and mcal targets.  It also provides a subject - observer mechanism.
</d>
 <da>2004-02-17 00:31:24</da>
 <n>The Log package now requires PHP 4.3.0 or later.

If an object or array is passed as a log event, its human-readable representation will be used.

It's now possible to specify the default priority for events logged using the log() method.</n>
 <f>29453</f>
 <g>https://pear.php.net/get/Log-1.8.4.tgz</g>
 <x xlink:href="package.1.8.4.xml"/>
</r>