<?xml version="1.0" encoding="UTF-8" ?>
<r xmlns="http://pear.php.net/dtd/rest.release"
    xmlns:xsi="http://www.w3.org/2001/XMLSchema-instance"
    xmlns:xlink="http://www.w3.org/1999/xlink"
    xsi:schemaLocation="http://pear.php.net/dtd/rest.release
    https://pear.php.net/dtd/rest.release.xsd">
 <p xlink:href="/rest/p/mail_mime">Mail_Mime</p>
 <c>pear.php.net</c>
 <v>1.8.7</v>
 <st>stable</st>
 <l>BSD Style</l>
 <m>alec</m>
 <s>Mail_Mime provides classes to create MIME messages.</s>
 <d>Mail_Mime provides classes to deal with the creation and manipulation of MIME messages.
It allows people to create e-mail messages consisting of:
* Text Parts
* HTML Parts
* Inline HTML Images
* Attachments
* Attached messages

It supports big messages, base64 and quoted-printable encodings and
non-ASCII characters in filenames, subjects, recipients, etc. encoded
using RFC2047 and/or RFC2231.</d>
 <da>2012-12-25 17:28:19</da>
 <n>* Bug #5333: Fix more return by reference errors [alec]
* Bug #19754: Fix compatibility with PHP4 [alec]</n>
 <f>31837</f>
 <g>https://pear.php.net/get/Mail_Mime-1.8.7.tgz</g>
 <x xlink:href="package.1.8.7.xml"/>
</r>