<?xml version="1.0" encoding="UTF-8" ?>
<r xmlns="http://pear.php.net/dtd/rest.release"
    xmlns:xsi="http://www.w3.org/2001/XMLSchema-instance"
    xmlns:xlink="http://www.w3.org/1999/xlink"
    xsi:schemaLocation="http://pear.php.net/dtd/rest.release
    https://pear.php.net/dtd/rest.release.xsd">
 <p xlink:href="/rest/p/php_docblockgenerator">PHP_DocBlockGenerator</p>
 <c>pear.php.net</c>
 <v>1.0.0RC1</v>
 <st>beta</st>
 <l>The BSD License</l>
 <m>mcorne</m>
 <s>DocBlock Generator</s>
 <d>Creates the file Page block and the DocBlocks for includes, global variables, functions, parameters, classes, constants, properties and methods.
Accepts parameters to set the category name, the package name, the author's name and email, the license, the package link, etc...
Attempts to guess variable and parameters types.
Aligns the DocBlock tags.
Tags are not updated or added to existing DocBlocks but only realigned.
The package can be run by: calling the &quot;PHP_DocBlockGenerator&quot; class, or by running the &quot;docblockgen&quot; DOS/Unix command.
Fully tested with phpUnit. Code coverage test close to 100%.</d>
 <da>2007-06-29 15:56:29</da>
 <n>* Initial PEAR release
* Testing with PHPUnit
* Using PHPCompat to determine the PHP version
* Using Consol_Getopt for the CLI
* Various fixes and enhancements</n>
 <f>41407</f>
 <g>https://pear.php.net/get/PHP_DocBlockGenerator-1.0.0RC1.tgz</g>
 <x xlink:href="package.1.0.0RC1.xml"/>
</r>