<?xml version="1.0" encoding="UTF-8" ?>
<r xmlns="http://pear.php.net/dtd/rest.release"
    xmlns:xsi="http://www.w3.org/2001/XMLSchema-instance"
    xmlns:xlink="http://www.w3.org/1999/xlink"
    xsi:schemaLocation="http://pear.php.net/dtd/rest.release
    https://pear.php.net/dtd/rest.release.xsd">
 <p xlink:href="/rest/p/image_puzzle">Image_Puzzle</p>
 <c>pear.php.net</c>
 <v>0.2.1</v>
 <st>beta</st>
 <l>PHP License</l>
 <m>fela</m>
 <s>Generates puzzle pieces from image file</s>
 <d>PEAR::Image_Puzzle divides an image to puzzle pieces.



* Provides a few edge styles to generate puzzle pieces

* Allow saving each piece to separate files

* Allow getting information about each piece coordinates accoring to original image
 
</d>
 <da>2006-04-29 01:50:02</da>
 <n>- changed saving files to proper file type according to given extension

			    - checking if type supports transparent colour

			    - fixed saving gif by limiting number of coulour to 256</n>
 <f>7467</f>
 <g>https://pear.php.net/get/Image_Puzzle-0.2.1.tgz</g>
 <x xlink:href="package.0.2.1.xml"/>
</r>