<?xml version="1.0" encoding="UTF-8" ?>
<r xmlns="http://pear.php.net/dtd/rest.release"
    xmlns:xsi="http://www.w3.org/2001/XMLSchema-instance"
    xmlns:xlink="http://www.w3.org/1999/xlink"
    xsi:schemaLocation="http://pear.php.net/dtd/rest.release
    https://pear.php.net/dtd/rest.release.xsd">
 <p xlink:href="/rest/p/net_ipv6">Net_IPv6</p>
 <c>pear.php.net</c>
 <v>1.1.0b1</v>
 <st>beta</st>
 <l>BSD</l>
 <m>alexmerz</m>
 <s>Check and validate IPv6 addresses</s>
 <d>The class allows you to:
* check if an address is an IPv6 address
* compress/uncompress IPv6 addresses
* check for an IPv4 compatible ending in an IPv6 address
* check the assigned address space of an IPv6 address
* do netmask calculations</d>
 <da>2008-10-27 21:09:19</da>
 <n>Because this release adds a new method and some bug tickets are still open, the package
release is named as Beta, instead of releasing a 5th RC version.

#14728   add parseAddress(), thanks to Nicholas Williams!
#14767   most CS issues should be solved</n>
 <f>6240</f>
 <g>https://pear.php.net/get/Net_IPv6-1.1.0b1.tgz</g>
 <x xlink:href="package.1.1.0b1.xml"/>
</r>