<?xml version="1.0" encoding="UTF-8" ?>
<r xmlns="http://pear.php.net/dtd/rest.release"
    xmlns:xsi="http://www.w3.org/2001/XMLSchema-instance"
    xmlns:xlink="http://www.w3.org/1999/xlink"
    xsi:schemaLocation="http://pear.php.net/dtd/rest.release
    https://pear.php.net/dtd/rest.release.xsd">
 <p xlink:href="/rest/p/validate">Validate</p>
 <c>pear.php.net</c>
 <v>0.7.0</v>
 <st>beta</st>
 <l>New BSD</l>
 <m>amir</m>
 <s>Validation class</s>
 <d>Package to validate various datas. It includes :
    - numbers (min/max, decimal or not)
    - email (syntax, domain check, rfc822)
    - string (predifined type alpha upper and/or lowercase, numeric,...)
    - date (min, max, rfc822 compliant)
    - uri (RFC2396)
    - possibility valid multiple data with a single method call (::multiple)</d>
 <da>2006-11-17 11:51:12</da>
 <n>- string():
 * New chars in VALIDATE_EALPHA_LOWER and UPPER
- date():
 * RFC822 date-time format compliant</n>
 <f>16841</f>
 <g>https://pear.php.net/get/Validate-0.7.0.tgz</g>
 <x xlink:href="package.0.7.0.xml"/>
</r>