<?xml version="1.0" encoding="UTF-8" ?>
<r xmlns="http://pear.php.net/dtd/rest.release"
    xmlns:xsi="http://www.w3.org/2001/XMLSchema-instance"
    xmlns:xlink="http://www.w3.org/1999/xlink"
    xsi:schemaLocation="http://pear.php.net/dtd/rest.release
    https://pear.php.net/dtd/rest.release.xsd">
 <p xlink:href="/rest/p/mdb2_driver_oci8">MDB2_Driver_oci8</p>
 <c>pear.php.net</c>
 <v>0.2.1</v>
 <st>alpha</st>
 <l>BSD License</l>
 <m>lsmith</m>
 <s>oci8 MDB2 driver</s>
 <d>This is the Oracle OCI8 MDB2 driver.
 
</d>
 <da>2005-12-28 05:25:21</da>
 <n>- fixed typo in _execute() that would lead to using the wrong types inside the result object
- fixed typo in _execute() that lead to using the wrong ressource inside the result object
- various fixes for alterTable()
- fixed testNow()

open todo items:
- handle autoincremement fields in alterTable()
- there are still a number of missing methods in the reverse and datatype module
- there are still severe stability issues due to ext/oci8, especially on windows
- ensure that all primary/unique/foreign key handling is only in the contraint methods</n>
 <f>18358</f>
 <g>https://pear.php.net/get/MDB2_Driver_oci8-0.2.1.tgz</g>
 <x xlink:href="package.0.2.1.xml"/>
</r>