<?xml version="1.0" encoding="UTF-8" ?>
<r xmlns="http://pear.php.net/dtd/rest.release"
    xmlns:xsi="http://www.w3.org/2001/XMLSchema-instance"
    xmlns:xlink="http://www.w3.org/1999/xlink"
    xsi:schemaLocation="http://pear.php.net/dtd/rest.release
    https://pear.php.net/dtd/rest.release.xsd">
 <p xlink:href="/rest/p/pearweb_gopear">pearweb_gopear</p>
 <c>pear.php.net</c>
 <v>1.1.4</v>
 <st>stable</st>
 <l>PHP License</l>
 <m>cweiske</m>
 <s>go-pear script for pear.php.net</s>
 <d>go-pear is the online PEAR installer: just download it and run it (through a browser or command line), it will set up a minimal PEAR installation that will be ready for immediatel use.

You can download go-pear from http://pear.php.net/go-pear
(this is merely the pearweb package hosting it)</d>
 <da>2009-09-07 22:33:39</da>
 <n>- text/javascript for all &lt;script&gt; [clockwerx]
- Fix bug #12910 - &lt;br&gt; begone! [clockwerx]</n>
 <f>24646</f>
 <g>https://pear.php.net/get/pearweb_gopear-1.1.4.tgz</g>
 <x xlink:href="package.1.1.4.xml"/>
</r>