<?xml version="1.0" encoding="UTF-8" ?>
<r xmlns="http://pear.php.net/dtd/rest.release"
    xmlns:xsi="http://www.w3.org/2001/XMLSchema-instance"
    xmlns:xlink="http://www.w3.org/1999/xlink"
    xsi:schemaLocation="http://pear.php.net/dtd/rest.release
    https://pear.php.net/dtd/rest.release.xsd">
 <p xlink:href="/rest/p/pear_info">PEAR_Info</p>
 <c>pear.php.net</c>
 <v>1.7.0RC3</v>
 <st>beta</st>
 <l>PHP License</l>
 <m>farell</m>
 <s>Show Information about your PEAR install and its packages</s>
 <d>This package generates a comprehensive information page for your current PEAR install.
* The format for the page is similar to that for phpinfo() except using PEAR colors.
* Has complete PEAR Credits (based on the packages you have installed).
* Will show if there is a newer version than the one presently installed (and what its state is)
* Each package has an anchor in the form pkg_PackageName - where PackageName is a case-sensitive PEAR package name</d>
 <da>2007-07-10 14:03:25</da>
 <n>* changes
- Credits page is now customizable with PEAR_INFO_CREDITS_* constant
- You may have a standalone html page (default behavior) with PEAR_INFO_FULLPAGE
  or just part of html code related to information wanted ; Easy to include in your own pages
- new method that give PEAR members list (president, group, docs, website)

Stable release 1.7.0 is scheduled for July 17. This is the last release candidate.</n>
 <f>20924</f>
 <g>https://pear.php.net/get/PEAR_Info-1.7.0RC3.tgz</g>
 <x xlink:href="package.1.7.0RC3.xml"/>
</r>