<?xml version="1.0" encoding="UTF-8" ?>
<r xmlns="http://pear.php.net/dtd/rest.release"
    xmlns:xsi="http://www.w3.org/2001/XMLSchema-instance"
    xmlns:xlink="http://www.w3.org/1999/xlink"
    xsi:schemaLocation="http://pear.php.net/dtd/rest.release
    https://pear.php.net/dtd/rest.release.xsd">
 <p xlink:href="/rest/p/http_request2">HTTP_Request2</p>
 <c>pear.php.net</c>
 <v>2.6.0</v>
 <st>stable</st>
 <l>BSD 3-Clause License</l>
 <m>avb</m>
 <s>Provides an easy way to perform HTTP requests.</s>
 <d>PHP5 rewrite of HTTP_Request package (with parts of HTTP_Client). Provides
cleaner API and pluggable Adapters:
  * Socket adapter, based on old HTTP_Request code,
  * Curl adapter, wraps around PHP's cURL extension,
  * Mock adapter, to use for testing packages dependent on HTTP_Request2.
Supports POST requests with data and file uploads, basic and digest
authentication, cookies, managing cookies across requests, proxies, gzip and
deflate encodings, redirects, monitoring the request progress with Observers...</d>
 <da>2023-11-01 16:04:51</da>
 <n>* Tested on PHP 8.2 and 8.3
* Use psalm for static analysis, several minor issues fixed
* Correctly parse HTTP status line with an empty reason-phrase
  (see https://github.com/pear/HTTP_Request2/pull/26)
* Updated Public Suffix List</n>
 <f>127945</f>
 <g>https://pear.php.net/get/HTTP_Request2-2.6.0.tgz</g>
 <x xlink:href="package.2.6.0.xml"/>
</r>