<?xml version="1.0" encoding="UTF-8" ?>
<r xmlns="http://pear.php.net/dtd/rest.release"
    xmlns:xsi="http://www.w3.org/2001/XMLSchema-instance"
    xmlns:xlink="http://www.w3.org/1999/xlink"
    xsi:schemaLocation="http://pear.php.net/dtd/rest.release
    https://pear.php.net/dtd/rest.release.xsd">
 <p xlink:href="/rest/p/image_graph">Image_Graph</p>
 <c>pear.php.net</c>
 <v>0.7.2</v>
 <st>alpha</st>
 <l>LGPL</l>
 <m>nosey</m>
 <s>A package for displaying (numerical) data as a graph/chart/plot.</s>
 <d>Image_Graph provides a set of classes that creates graphs/plots/charts based on (numerical) data.

Many different plot types are supported: Bar, line, area, step, impulse, scatter, radar, pie, map, candlestick, band, box &amp; whisker and smoothed line, area and radar plots.

The graph is highly customizable, making it possible to get the exact look and feel that is required.

The output is controlled by a Image_Canvas, which facilitates easy output to many different output formats, amongst others, GD (PNG, JPEG, GIF, WBMP), PDF (using PDFLib), Scalable Vector Graphics (SVG).

Image_Graph is compatible with both PHP4 and PHP5.
 
</d>
 <da>2006-03-02 07:42:17</da>
 <n>* Added Pie chart support for grouping items with values below a specified threshold in a &quot;the rest&quot; group
* Added possibility to set color of axis ticks (thanks to bdondo from forum)
* Added clipping support, causing forceMinimum() and forceMaximum() to show expected results
* Modified axis arrows, so that an axis with all negative values, the arrow will be shown at the minimum value instead of maximum
* Fixed a bug with Image_Graph_DataPreprocessor_Function not working, when callback function is an object method
* Fixed a bug with Candlestick, Band and Box &amp; Whisker plots not working when using markers
* Fixed Bug #6024 &quot;Undefined variable: parameters&quot;
* Fixed Bug #6085 &quot;Graph doesn't understand a numeric variable extracted from the GET method.&quot;
* Fixed Bug #6919 &quot;Isolated points in linegraphs with breaks drawn incorrectly&quot;
* Fixed Bug #6921 &quot;Marker not drawn for points with Y value == 0&quot;
* Fixed Bug #6941 &quot;Logarithmic axis values between 0 and 1&quot;
* Fixed Request #5985 &quot;Logarithmic Axis Minimum Value&quot;
* Fixed a problem with labels not appearing on the same baseline
* Added possibility to specify padding on all edges of an element separately
* Updated some API documentation entries</n>
 <f>368056</f>
 <g>https://pear.php.net/get/Image_Graph-0.7.2.tgz</g>
 <x xlink:href="package.0.7.2.xml"/>
</r>