<?xml version="1.0" encoding="UTF-8" ?>
<r xmlns="http://pear.php.net/dtd/rest.release"
    xmlns:xsi="http://www.w3.org/2001/XMLSchema-instance"
    xmlns:xlink="http://www.w3.org/1999/xlink"
    xsi:schemaLocation="http://pear.php.net/dtd/rest.release
    https://pear.php.net/dtd/rest.release.xsd">
 <p xlink:href="/rest/p/html_table">HTML_Table</p>
 <c>pear.php.net</c>
 <v>1.1</v>
 <st>stable</st>
 <l>PHP License</l>
 <m>mansion</m>
 <s>PEAR::HTML_Table makes the design of HTML tables easy, flexible, reusable and efficient.</s>
 <d>The PEAR::HTML_Table package provides methods for easy and efficient design of HTML tables.
* Lots of customization options.
* Tables can be modified at any time.
* The logic is the same as standard HTML editors.
* Handles col and rowspans. 
* PHP code is shorter, easier to read and to maintain.
* Tables options can be reused.
</d>
 <da>2002-07-21 18:44:00</da>
 <n>Added new most-wanted features:
* Accept TR tags attributes
* Accept alternatives for cell attributes in rows and columns
* Can get cell attributes
* Can get row attributes
* RaiseError fixes.</n>
 <f>5168</f>
 <g>https://pear.php.net/get/HTML_Table-1.1.tgz</g>
 <x xlink:href="package.1.1.xml"/>
</r>