<?xml version="1.0" encoding="UTF-8" ?>
<r xmlns="http://pear.php.net/dtd/rest.release"
    xmlns:xsi="http://www.w3.org/2001/XMLSchema-instance"
    xmlns:xlink="http://www.w3.org/1999/xlink"
    xsi:schemaLocation="http://pear.php.net/dtd/rest.release
    https://pear.php.net/dtd/rest.release.xsd">
 <p xlink:href="/rest/p/structures_datagrid_renderer_xul">Structures_DataGrid_Renderer_XUL</p>
 <c>pear.php.net</c>
 <v>0.1.2</v>
 <st>beta</st>
 <l>New BSD</l>
 <m>wiesemann</m>
 <s>Renderer driver that generates the XML string for a XUL listbox</s>
 <d>This is a Renderer driver for Structures_DataGrid that generates the XML
string for a XUL listbox.</d>
 <da>2006-12-16 11:13:18</da>
 <n>- Bug #9548: added support for per-column default sort directions
  (thanks to Anton, hire at ukr dot net)
- this package is now licensed under the New BSD license</n>
 <f>3974</f>
 <g>https://pear.php.net/get/Structures_DataGrid_Renderer_XUL-0.1.2.tgz</g>
 <x xlink:href="package.0.1.2.xml"/>
</r>