<?xml version="1.0" encoding="UTF-8" ?>
<r xmlns="http://pear.php.net/dtd/rest.release"
    xmlns:xsi="http://www.w3.org/2001/XMLSchema-instance"
    xmlns:xlink="http://www.w3.org/1999/xlink"
    xsi:schemaLocation="http://pear.php.net/dtd/rest.release
    https://pear.php.net/dtd/rest.release.xsd">
 <p xlink:href="/rest/p/services_trackback">Services_Trackback</p>
 <c>pear.php.net</c>
 <v>0.6.2</v>
 <st>beta</st>
 <l>PHP License</l>
 <m>doconnor</m>
 <s>Trackback - A generic class for sending and receiving trackbacks.</s>
 <d>A generic class for sending and receiving trackbacks.</d>
 <da>2008-10-01 10:19:42</da>
 <n>Fixes for Bug #13456 and Bug #13457 - reset() was not functional for two drivers.
Implemented a Mock SpamCheck driver for ease of unit testing
Upgraded to work with PHPUnit 3
PHPCS improvements</n>
 <f>20003</f>
 <g>https://pear.php.net/get/Services_Trackback-0.6.2.tgz</g>
 <x xlink:href="package.0.6.2.xml"/>
</r>